id,category,text
22369167,externe,"Kadri Simson a mai spus $NE$ $NE$ se pregÄteÅte pentru o Ã ® ncetare bruscÄ a furnizÄrii de gaz $NE$ atunci cÃ¢nd contractul de tranzit dintre $NE$ Åi $NE$ va expira la sfÃ¢rÅitul acestui an . Trupele $NE$ Ã ® ncearcÄ sÄ strÄpungÄ apÄrarea $NE$ Åi sÄ ajungÄ Ã ® n oraÅele Pokrovsk Åi Kurakhove din regiunea DoneÅ£k , a declarat comandantul-Åef Oleksandr SÃ ® rskÃ ® i pe 6 mai .   Vorbind la televiziunea naÅ£ionalÄ , un purtÄtor de cuvÃ¢nt al ForÅ£elor de ApÄrare Sudice , a declarat $NE$ trupele $NE$ au Ã ® ncercat fÄrÄ succes sÄ ia cu asalt poziÅ£iile $NE$ de $NE$ ori ,    pierzÃ¢nd $NE$ $NE$ Ã ® n acest proces . "" $NE$ capacitÄÅ£i suplimentare necontractate Åi dorim ca acestea sÄ fie finanÅ£ate Ã ® n detrimentul fondurilor $NE$ "" , a declarat pe 6 mai ministrul Industriilor Strategice , Oleksandr Kamyshin . Multe Å£Äri $NE$ , precum Marea Britanie , $NE$ , Cehia Åi altele , au declarat $NE$ vor boicota ceremonia de inaugurare . Uniunea EuropeanÄ a Ã ® nceput sÄ lucreze la Ã ® nfiinÅ£area unui nou birou pentru inovaÅ£ie Ã ® n domeniul apÄrÄrii la $NE$ , a declarat $NE$ $NE$ pentru piaÅ£a internÄ , Thierry Breton , la 6 mai , Ã ® n    cadrul Forumului UE-Ucraina pentru industriile de apÄrare . ForÅ£ele $NE$ au lovit regiunea $NE$ cu o bombÄ FAB-1500 lansatÄ din aer pentru $NE$ datÄ de la Ã ® nceputul invaziei , a raportat poliÅ£ia regiunii $NE$ pe 6 mai . "" Trebuie sÄ creÅtem semnificativ producÅ£ia de explozibili . Prin urmare , trebuie sÄ luÄm serios Ã ® n considerare rolul industriei naÅ£ionale Ã ® n aceastÄ chestiune "" , a declarat ministrul finlandez al    ApÄrÄrii , Antti Hakkanen . $NE$ a declarat $NE$ exerciÅ£iile , care vizeazÄ arme nucleare nestrategice care pot fi folosite Ã ® n situaÅ£ii de luptÄ , sunt un rÄspuns la "" declaraÅ£iile provocatoare "" ale $NE$ $NE$ ,    inclusiv ale lui $NE$ , informeazÄ Financial Times . PreÅedintele FranÅ£ei a reafirmat sÄptÄmÃ¢na trecutÄ $NE$ nu exclude posibilitatea de a trimite trupe Ã ® n $NE$ , Ã ® n timp ce a avertizat asupra ameninÅ£Ärii pe care invazia $NE$ o $NE$ pentru    $NE$ . $NE$ a pierdut $NE$ de soldaÅ£i Ã ® n $NE$ de la Ã ® nceputul invaziei , a raportat Statul Major General al ForÅ£elor Armate ale $NE$ . Acest numÄr include $NE$ de pierderi suferite de forÅ£ele $NE$ Ã ® n ultima zi . Potrivit raportului , $NE$ a pierdut , de asemenea , $NE$ de $NE$ , $NE$ $NE$ blindate de luptÄ , 16.477 de $NE$ Åi rezervoare de combustibil , $NE$ de sisteme de artilerie , $NE$ de    sisteme de rachete cu lansare multiplÄ , $NE$ de sisteme de apÄrare aerianÄ , $NE$ de $NE$ , $NE$ de $NE$ , $NE$ de drone , $NE$ de $NE$ Åi ambarcaÅ£iuni Åi un $NE$ . $NE$ a redislocat un batalion al Diviziei 76 Aeropurtate Ã ® n $NE$ Åi Ã ® ncearcÄ sÄ strÃ¢ngÄ Ã ® ndeajuns de mulÅ£i $NE$ pentru o viitoare operaÅ£iune ofensivÄ asupra nord-estului $NE$ Åi a    oraÅului $NE$ . Institutul pentru Studiul RÄzboiului avertizeazÄ $NE$ $NE$ trebuie sÄ $NE$ cÃ¢t mai curÃ¢nd iniÅ£iativa pe cÃ¢mpul de luptÄ , pentru $NE$ altfel $NE$ va obÅ£ine mai multe avantaje Ã ® n acest an . $NE$ a strÃ¢ns Ã ® n jur de $NE$ de $NE$ Ã ® n $NE$ , $NE$ Åi Briansk Ã ® n cadrul grupelor $NE$ din $NE$ . De asemenea , divizia a treia de $NE$ aeropurtate din Regimentul $NE$ se aflÄ Ã ® n $NE$ .    AceÅti $NE$ se aflau anterior Ã ® n $NE$ , prin februarie Åi martie , deci au fost mutaÅ£i din sudul $NE$ la graniÅ£a rusÄ cu nord-estul $NE$ .    $NE$ rusÄ ia , se pare , trupe din    Districtul militar Leningrad Åi le pregÄteÅte Ã ® n $NE$ $NE$ din nord pentru a lupta Ã ® n special pe direcÅ£ia operaÅ£ionalÄ Belgorod-Harkov .    Pe lÃ¢ngÄ trupe , sunt transferate Åi echipamente    militare Ã ® n aceste zone . Ministerul ucrainean al ApÄrÄrii a distribuit $NE$ de la un atac cu o dronÄ maritimÄ Magura V5 asupra unei $NE$ rapide ruseÅti din Crimeea ocupatÄ. Misiunea de luptÄ a fost condusÄ de unitatea    "" Grupul $NE$ "" a informaÅ£iilor militare $NE$ Ã ® n colaborare cu platforma de strÃ¢ngere de fonduri United24 , Ã ® n Golful Vuzka , din apropiere de localitatea Ciornomorske din Crimeea . PurtÄtorul de cuvÃ¢nt al ForÅ£elor Navale Ucrainene , Dmytro Pletenchuk , a declarat anterior $NE$ $NE$ Åi -a retras aproape toate navele majore din porturile din Crimeea ocupatÄ , Ã ® n urma loviturilor    $NE$ reuÅite . Un atac cu drone Ã ® n regiunea $NE$ din $NE$ ar fi ucis Åase $NE$ Åi ar fi rÄnit cel puÅ£in $NE$ , potrivit $NE$ Viaceslav Gladkov . Gladkov a declarat $NE$ dronele au lovit $NE$ care transportau muncitori la o fabricÄ din apropierea satului Berezovka Åi $NE$ Åase $NE$ au murit . InformaÅ£ia nu a putut fi verificatÄ Ã ® n mod independent , iar $NE$ nu comenteazÄ de obicei presupusele atacuri pe teritoriul $NE$ . Regiunea $NE$ se Ã ® nvecineazÄ cu regiunile $NE$ SumÃ ® , $NE$ Åi Lugansk . UnitÄÅ£ile $NE$ de apÄrare aerianÄ au distrus $NE$ din cele $NE$ drone de tip $NE$ pe care $NE$ le- a lansat Ã ® n cursul $NE$ , a raportat ForÅ£ele Aeriene la 6 mai . Dronele au fost lansate din regiunea Ã ® nvecinatÄ $NE$ din $NE$ Åi au vizat regiunea $NE$ din nord-estul $NE$ . DeÅi grupurile mobile de apÄrare aerianÄ ale ForÅ£elor Aeriene $NE$ au interceptat dronele deasupra Oblastului $NE$ , forÅ£ele ruseÅti au lovit infrastructura energeticÄ $NE$ din regiune Ã ® n    jurul orei locale de la $NE$ $NE$ . $NE$ au anunÅ£at ulterior $NE$ instalaÅ£iile de infrastructurÄ critice , inclusiv cele de alimentare cu apÄ Åi spitalele , au fost transferate pe energie de rezervÄ. Atacurile cu drone sunt un eveniment zilnic Ã ® n $NE$ , afectÃ¢nd diverse regiuni din $NE$"
22369093,externe,"$NE$ a strâns în jur de $NE$ de $NE$ în $NE$ , $NE$ şi $NE$ în cadrul grupelor $NE$ din $NE$ . De asemenea , divizia a treia de forţe aeropurtate din Regimentul $NE$ se află în $NE$ .    Aceşti $NE$ se aflau anterior în $NE$ , prin februarie şi martie , deci au fost mutaţi din sudul $NE$ la graniţa $NE$ cu nord-estul $NE$ .    Armata $NE$ ia , se pare , trupe din    Districtul militar $NE$ şi le pregăteşte în grupele $NE$ din nord pentru a lupta în special pe direcţia operaţională Belgorod-Harkov .    Pe lângă trupe , sunt transferate şi echipamente    militare în aceste zone .   Recent , $NE$ a intensificat atacurile aeriene cu $NE$ şi $NE$ în regiunile $NE$ , $NE$ şi $NE$ . De altfel , armata $NE$ a avertizat , în ultima perioadă , că $NE$ ar putea să    desfăşoare o operaţiune ofensivă pentru a captura oraşul $NE$ , însă Institutul pentru Studiul Războiului consideră că armata $NE$ nu are forţele necesare pentru a ocupa oraşul , dar ar putea , prin    acţiunile de ofensivă atât împotriva oraşului $NE$ , cât şi a oraşului $NE$ să atragă atenţia $NE$ $NE$ de la alte părţi critice ale frontului . Totodată , în contextul în care $NE$ pe securitate naţională al $NE$ , Jake Sullivan , a declarat recent că $NE$ va desfăşura abia în $NE$ operaţiuni de contraofensivă pentru recâştigarea    teritoriului ocupat de ruşi , după ce va folosi , anul acesta , ajutorul primit de la $NE$ pentru a opri avansarea trupelor $NE$ , $NE$ de la Institutul pentru Studiul Războiului cred că aceste    echipamente militare $NE$ vor permite ucrainenilor să stabilizeze $NE$ şi să ia iniţiativa mai curând , pentru că altfel , dacă nu vor prelua iniţiativa în $NE$ , vor permite $NE$ să decidă    momentul , locaţia şi intensitatea atacurilor lor în $NE$ . Doar pe 5 mai , ruşii au rănit grav $NE$ civili , după ce au atacat mai multe clădiri rezidenţiale cu bombe D30-SN de calibru 30 de mm ."
22369141,social,"Cercetările sugerează că aproximativ jumătate din terenurile cele mai potrivite pentru cultivarea cafelei vor deveni improprii pentru acest scop până în $NE$ , din cauza schimbărilor $NE$ . În    $NE$ , această cifră ajunge la $NE$ . Companii mari folosesc biotehnologia şi ştiinţa alimentară pentru a crea alternative la cafeaua obişnuită , folosind ingrediente diverse , de la năut la deşeuri agricole reciclate , inclusiv $NE$    de curmale , potrivit The Wall Street Journal .   Alte abordări utilizează celule cultivate în laborator din plante de $NE$ reale . Una dintre cele mai mari companii alimentare din lume , $NE$ , a semnat recent un acord pentru a deveni distribuitorul exclusiv între întreprinderi al $NE$ fără $NE$ şi fără nuci ale    producătorului de $NE$ fără boabe Voyage Foods . Dacă aceste companii ajung la un număr suficient de mare de $NE$ , va fi un caz clasic a ceea ce $NE$ şi $NE$ $NE$ $NE$ „ efectul de substituţie ” : Pe măsură ce cafeaua    tradiţională devine mai rară şi mai scumpă , consumatorii vor trece la alternative mai ieftine şi mai multe . Iar cafeaua ar putea fi doar începutul . Voyage Foods vinde deja o alternativă $NE$ fără nuci şi fără $NE$ . Compania spune că produsul său este comparabil ca preţ cu $NE$ „ adevărată "" . Pentru ca oamenii să se convertească de la mărcile pe care le cunosc , trebuie ca schimbarea să nu îi coste nimic , iar înlocuitorul trebuie să aibă un gust bun , spune directorul executiv Adam    Maxwell . „ O boabă de $NE$ verde nu are niciun gust asemănător cu cel al unei $NE$ de $NE$ pe care o bem şi de care ne bucurăm "" , spune el . „ Experienţa pe care o avem de la $NE$ sau de la ciocolată este    într-adevăr determinată de procesul folosit pentru a le produce "" ."
22368773,politic,"Aproximativ $NE$ de $NE$ s- au adunat în $NE$ , al doilea oraş ca mărime din $NE$ , pentru a- l susţine pe Péter $NE$ , un personaj nou pe scena politică de la $NE$ . Acesta a devenit    proeminent datorită promisiunilor de a pune capăt unor probleme cu care societatea $NE$ se confruntă , printre care $NE$ oficială şi declinul calităţii vieţii , notează Associated Press ( AP ) .   $NE$ a fost un apropiat al partidului Fidesz , care se află la putere în $NE$ , dar acum se află în opoziţie . În luna februarie , acesta l- a acuzat pe Viktor Orbán că guvernează un , , stat mafiot ""    înrădăcinat şi a declarat război la ceea ce el numeşte o $NE$ de propagandă condusă de $NE$ , potrivit agenţiei Reuters . În cadrul mitingului , Peter $NE$ a atacat una dintre politicile de bază ale lui $NE$ , criticând ceea ce el a numit nivelul extrem de scăzut al $NE$ pentru susţinerea $NE$ în $NE$ . , , $NE$ , marea majoritate a $NE$ $NE$ s- a săturat de elita conducătoare , de ură , de apatie , de propagandă şi de diviziunile artificiale "" , a declarat $NE$ în faţa mulţimii . "" Maghiarii de    astăzi doresc cooperare , dragoste , unitate şi pace "" , a afirmat acesta , potrivit sursei citate . Peter $NE$ a mai organizat în luna aprilie un miting , unde zeci de mii de $NE$ au protestat , la $NE$ , împotriva premierului Viktor $NE$ . Luna trecută , acesta a anunţat că şi- a înfiinţat propriul partid , $NE$ ( Respect şi Libertate ) , conform publicaţiei $NE$ . Peter $NE$ a anunţat că va prezenta $NE$ candidaţi pentru alegerile europene    din luna iunie , el aflându -se în fruntea listei . Totodată , potrivit AP , partidul lui $NE$ a anunţat că va prezenta $NE$ candidaţi la alegerile pentru consiliile locale din $NE$ ."
22368716,cultura-media,"Actorul Bernard Hill , cunoscut publicului larg pentru rolurile sale din Titanic şi $NE$ inelelor , a murit la vârsta de 79 de ani , relatează $NE$ . $NE$ l- a interpretat pe căpitanul Edward Smith în filmul premiat cu Oscar în $NE$ . Un alt rol important a fost cel al regelui Théoden în trilogia $NE$ inelelor . Rolul său de debut a fost Yosser Hughes , în drama Boys from the Blackstuff . Agentul său , Lou Coulson , a confirmat pentru $NE$ News că acesta a murit la primele ore ale dimineţii .   "
22368703,externe,"$NE$ armată a grupării $NE$ a revendicat $NE$ responsabilitatea pentru un atac asupra punctului de trecere a frontierei Kerem Shalom dintre $NE$ şi $NE$ , despre care presa $NE$ şi cea    $NE$ au relatat că s- a soldat cu $NE$ $NE$ . Armata $NE$ a declarat că $NE$ $NE$ au fost lansate de la $NE$ , în sudul $NE$ , spre punctul de trecere , despre care a spus că este acum închis pentru camioanele cu ajutoare pentru $NE$    $NE$ . Alte puncte de trecere rămân deschise , notează $NE$ .   $NE$ armată a $NE$ a declarat că a lansat $NE$ asupra unei baze militare $NE$ de lângă punctul de trecere Kerem Shalom , dar nu a precizat dacă acestea au fost lansate din $NE$ . Peste un milion de $NE$ se adăpostesc în $NE$ , în apropiere de graniţa cu $NE$ . $NE$ a promis să intre în sudul oraşului $NE$ şi să elimine forţele $NE$ din zonă , dar s- a confruntat cu presiuni internaţionale tot mai mari să nu o facă , deoarece operaţiunea ar periclita    eforturile umanitare pentru $NE$ şi ar putea pune în pericol multe vieţi . Atacul de $NE$ asupra punctului de trecere Kerem Shalom a avut loc în timp ce speranţele privind negocierile de încetare a focului , în curs de desfăşurare la $NE$ , s- au diminuat ."
22368701,social,"Studiul a fost realizat în colaborare cu Liga Anti-Defăimare ( $NE$ ) din $NE$ şi relevă faptul că $NE$ $NE$ din întreaga lume ar putea fi în curând în imposibilitatea de a trăi în siguranţă , notează    Deutsche Welle . Raportul arată că $NE$ antisemitismul a crescut de la atacul    $NE$ asupra $NE$ din 7 octombrie anul trecut , în $NE$ nouă luni ale anului 2023 s- a înregistrat , de asemenea , o creştere a incidentelor antisemite comparativ cu $NE$ .   Raportul a subliniat că ura crescută faţă de $NE$ nu poate fi asociată cu emoţiile generate de răspunsul $NE$ împotriva grupării $NE$ în Fâşia $NE$ , întrucât multe acte de $NE$ au    avut loc inclusiv înainte de începerea acestei $NE$ , relevă sursa citată . Raportul a citat cifre din mai multe ţări , iar $NE$ studiului au constatat că numărul cazurilor din ultimele 3 luni ale anului trecut egalează sau chiar depăşeşte valorile raportate în $NE$    nouă luni ale anului 2023 . $NE$ a raportat $NE$ de incidente antisemite în perioada ianuarie-septembrie 2023 , însă după atacul din 7 octombrie şi răspunsul $NE$ în $NE$ au fost raportate $NE$ din octombrie până în    decembrie anul trecut . Raportul mai precizează că în Statele Unite au fost raportate aproximativ $NE$ de incidente antisemite între ianuarie şi septembrie 2023 , dar aproape $NE$ în ultimele trei luni ale anului . Totodată , raportul a arătat că incidentele în $NE$ au crescut de $NE$ ori , de la $NE$ în $NE$ la 1.676 anul trecut . Datele raportului mai relevă că antisemitismul a crescut inclusiv în campusurile $NE$ , pe care $NE$ $NE$ l- a numit aspectul .. cel mai alarmant "" al valului de ură împotriva $NE$ din Statele    Unite , notează Times of Israel . Unul dintre $NE$ raportului , profesorul Uriya Shavit de la Universitatea din Tel Aviv , a subliniat că situaţia riscă să aibă efecte negative asupra statutului de $NE$ . , , Dacă tendinţele actuale    continuă , cortina va coborî asupra capacităţii de a duce o viaţă de $NE$ în $NE$ - de a purta o stea a lui $NE$ , de a frecventa sinagogi şi centre comunitare , de a trimite $NE$ la şcoli    evreieşti , de a frecventa un club $NE$ în campus sau de a vorbi ebraică "" . Atacul $NE$ asupra $NE$ , care a avut loc în 7 octombrie anul trecut , s- a soldat cu aproape $NE$ de morţi , majoritatea civili . În replică , $NE$ a lansat o ofensivă împotriva $NE$ în    Fâşia $NE$ , iar până în prezent , datele oficiale arată că peste $NE$ de civili au fost ucişi în urma atacurilor .  "
22368662,economic,"$NE$ avea în anul 2022 un număr total de $NE$ $NE$ de întreprinderi , dintre care $NE$ erau multinationale , majoritatea cu actionariat $NE$ , $NE$ sau $NE$ , şi doar putin peste $NE$    erau rezidente , potrivit celor mai recente date publicate de Institutul Naţional de Statistică ( $NE$ ) .   Astfel , din cele $NE$ de $NE$ de întreprinderi multinaţionale , $NE$ erau controlate din interior , iar $NE$ din străinătate . De asemenea , $NE$ sunt $NE$ controlate de persoane juridice străine , iar $NE$ sunt $NE$ controlate de persoane fizice străine . În acelaşi timp , în $NE$ activau $NE$ $NE$ rezidente . În ceea ce priveşte domeniul de activitate , o treime dintre $NE$ sunt din sectorul comerţului , urmate de cele din $NE$ ( $NE$ ) , activităţi profesionale , ştiinţifice şi tehnice , precum şi    industria prelucrătoare ( câte $NE$ din totalul grupurilor ) . Alte $NE$ dintre $NE$ apartin zonei de tranzacţii imobiliare . Ordinea se mentine şi în cazul grupurilor rezidente , unde comertul detine o pondere de $NE$ , constructiile $NE$ , iar industria prelucrătoare de $NE$ .   Raportat la numărul total de salariati din $NE$ , $NE$ dintre ei lucrează în $NE$ multinationale controate din străinătate , iar $NE$ apartin grupurilor controlate din primele 10 tări . În funcţie de ponderea numărului de $NE$ , pe $NE$ loc se află subgrupurile de întreprinderi controlate de persoane juridice sau persoane fizice din $NE$ ( $NE$ ) , pe locul $NE$ sunt cele    controlate din $NE$ ( $NE$ ) , iar pe locul $NE$ sunt cele controlate din Statele Unite ale Americii ( $NE$ ) . În cazul grupurilor cu actionatiat $NE$ , cei mai multi angajati sunt în industria prelucrătoare ( $NE$ ) , comerţ cu ridicata şi cu amănuntul ; Repararea autovehiculelor şi motocicletelor ( $NE$ ) şi    în activităţi profesionale , ştiinţifice şi tehnice ( $NE$ ) . La grupurile cu actionari $NE$ , $NE$ din $NE$ sunt în industria prelucrătoare , $NE$ în comerţ , iar $NE$ în $NE$ şi comunicaţii . Subgrupurile de întreprinderi controlate din Statele Unite ale Americii au cei mai mulţi $NE$ în Industria prelucrătoare ( $NE$ ) şi $NE$ şi comunicaţii ( $NE$ ) . Potrivit $NE$ , grupul multinational este format din cel puţin $NE$ unităţi legale localizate în ţări diferite , iar cel rezident este grupul de întreprinderi ale cărui unităţi legale ( întreprinderi )    sunt toate rezidente în aceeaşi ţară ."
