id,category,text
741234,stiri-auto,"Grație unei colaborări cu Centrul auto GEELY al DAAC Hermes, Lana vă dezvăluie tot ce trebuie să știți despre acest automobil modern. Cu un motor puternic și o sumedenie de sisteme de asistență pentru șofer, COOLRAY se remarcă prin confort și design elegant. Lana ne împărtășește impresiile sale, subliniind cum fiecare detaliu și fiecare inovație fac din COOLRAY alegerea perfectă pentru iubitorii de tehnologie și stil. Acesta este doar începutul unei călătorii prin lumea GEELY alături de Lana. Rămîneți cu noi pentru mai multe recenzii din gama de modele GEELY, care continuă să ne încînte prin inovație, stil și tehnologie.  "
742681,sport," Astfel, FC Chișinău a învins formația din capitala nordului, FC Belceanka, cu scorul de 1-0 și va întîlni Agarista-CSF Anenii Noi 2020 în semifinală, anunță Federația Moldovenească de Fotbal (FMF). Potrivit FMF, formația din Chișinău s-a impus și în meciul tur, în fața echipei FC Belceanka, cu scorul de 2-1. Rezultatul manșei retur, 1/4 de finală: 17 aprilie. Ora 16:00. Stadionul LT „Petru Zadnipru”, Chișinău FC Chișinău - FC Belceanka 1-0 (Doina Ciobanu, 23) Astfel, perechile din semifinale, care vor lupta pentru trofeul competiției sunt: CS Noroc Nimoreni - Real Succes ȘS11 Pudra Chișinău; Agarista CSF Anenii Noi 2020 - FC Chișinău. Meciurile semifinale vor avea loc pe 24 aprilie (tur) și 1 mai (retur). Ora partidelor va fi anunțată ulterior, conform regulamentului Cupei Moldovei la Fotbal Feminin, ediția 2023/24. Programul meciurilor. "
742651,societate, 19.04.2024 Pentru informații suplimentare contactați Serviciul Suport Clienți al companiei la telefonul 022-43-11-11. 
742671,economie," Este vorba de un volum de 12.800 MWh sau 20 milioane metri cubi (estimativ) pentru luna mai 2024, conform datelor publicate de Moldovagaz pe platforma de tranzacţionare, scrie mold-street.com. Livrările ar urma să fie proporțional numărului de zile, a cîte 6.864,5 MWh/zi sau 645.161 metri cubi pe zi (estimativ) cu limita de toleranță ± 20% la cantitatea zilnică. Şedinţa de tranzacţionare se va desfăşura pe ringul simplu şi competitiv, în data de 23 aprilie 2024. Potrivit informaţiilor de pe platformă, preţul de contract ""va fi calculat ca prețul cel mai mic obținut în urma ședinței de tranzacționare, în Euro/MWh, fără TVA, acesta va rămîne ferm şi neprevizuibil pe toată perioada de derulare a contractului"". Este indicată şi formula de calculare, condiţiile şi termenele de livrare. Conform Contractului și Caietului de Sarcini este necesară şi o garanţie de 2% din prețul total calculat la 17.04.2024 - 139.555 Euro plătibili în lei moldoveneşti la cursul Băncii Naţionale a Moldovei din ziua plății.  Amintim că potrivit Dispoziției Comisiei pentru Situaţii Excepţionale nr.97 din 27.12.2023, în perioada ianuarie – aprilie 2024 compania Energocom (100% capital de stat) vinde gaze natur ale către Moldovagaz la preț de 550 euro pentru o mie de metri cubi. Totuşi în urma unei licitații din 4 aprilie, Agenția Proprietății Publice, în calitate de acționar unic, și Consiliul SA Energocom au agreat, pentru luna aprilie, scăderea prețului respectiv la 450 euro pentru o mie de metri cubi. Altfel spus, preţul mediu de vînzare a scăzut în aprilie cu 100 de euro pentru o mie de metri cubi. Mai adăugăm că platforma Bursei Romîne de Mărfuri la Chișinău a devenit operaţională la începutul lunii, iar săptămîna trecută a avut loc prima tranzacție de gaze, procurate de către CET Nord de la Natural. Din luna mai, toți marii consumatori, inclusiv Moldovagaz, sînt asteptați pe bursă, iar de la 1 ianuarie 2025, toate întreprinderile mari vor fi obligate să iasă in piața liberă, la Bursă sau prin contracte bilaterale. "
742663,capitala," În cadrul vizitei, edilul a discutat cu reprezentanții administrației locale despre proiectele realizate în comun, necesitățile și obiectivele investiționale, care pot să fie implementate împreună, în cel mai scurt timp. De asemenea, a mai adăugat edilul, la solicitarea administrației locale și a locuitorilor din orașul Cricova, împreună cu responsabilii întreprinderilor municipale, privind lansarea unei noi rute de transport public municipal din Chișinău spre Cricova, prin sectorul Râșcani. În ultimii ani, Primăria municipiului Chișinău și Primăria orașului Cricova au implementat mai multe proiecte pentru locuitorii suburbiei, printre care: construcția rețelelor de canalizare, a Stației de epurare, extinderea iluminatului public stradal, îmbunătățirea infrastructurii educaționale, reparația capitală a Centrului de Sănătate. Astfel, cifra investițiilor municipale directe desfășurate la Cricova a ajuns la aproape 17 milioane de lei. "
742660,societate," Tehnica militară urmează să se întoarcă în centrele de instruire, la locurile de dislocare permanentă, transmite Noi.md. „JCET-2024” se desfășoară în conformitate cu planul de instruire al Armatei Naționale pentru anul 2024. Militarii din Batalionul cu Destinație Specială „Fulger” participă la acest exercițiu începînd cu anul 2009. Amintim că exercițiul multinațional „JCET-2024’’ a avut loc în perioada 1-19 aprilie curent, cu participarea militarilor moldoveni, români și americani, având ca scop antrenarea în comun, precum și creșterea nivelului de interoperabilitate între contingentele participante. Antrenamentele au avut loc la centrele de instruire ale Armatei Naționale.  "
742684,in-lume," În cadrul unui interviu acordat agenţiei de presă BTA la Washington, cu ocazia reuniunilor de primăvară ale Băncii Mondiale şi Fondului Monetar Internaţional, Radev a explicat că această nouă dată este un scenariu mai realist în stadiul actual prin care trece economia zonei euro, transmite Noi.md cu referire la digi24.ro. Chiar dacă inflaţia în Bulgaria a scăzut pentru a opta lună consecutiv, scăderea ar trebui să fie mult mai importantă pentru a permite intrarea Bulgariei în zona euro, a spus Radev. În acest context, dacă Bulgaria nu reuşeşte să îndeplinească criteriul de inflaţie în luna iunie şi va face acest lucru la finele lui 2024, aderarea la zona euro la finele lui 2024, în loc de 1 ianuarie, este posibilă şi, la acest moment, acesta este cel mai probabil scenariu, potrivit guvernatorului BNB. În condiţiile în care în prezent în Bulgaria există un acord de tip Consiliu monetar, Banca Naţională are un număr mult mai limitat de opţiuni pentru a controla inflaţia, aşa că este sarcina politicii fiscale să influenţeze într-o măsură mai mare preţurile, a spus Radev. ""Bugetul ar trebui să fie unul anti-ciclic, cu alte cuvinte, anti-inflaţionist, ceea ce nu este cazul în acest moment. Experienţa globală, precum şi propria noastră experienţă, ne arată că acest lucru poate fi atins cel mai bine prin măsuri eficiente de management şi control al costurilor"", a apreciat guvernatorul Băncii Naţionale a Bulgariei. Referindu-se la pregătirile tehnice pentru aderarea Bulgariei la zona euro, Radev a spus că Banca Naţională şi sectorul bancar au ajuns la un stadiu foarte avansat de pregătire, cu rezultate concrete în termeni de cadru instituţional, capacităţi şi logistică. De asemenea, Radev a făcut comentarii cu privire la creşterea sectorului creditului ipotecar, spunând: ""monitorizăm cu atenţie şi analizăm piaţa creditului şi ceea ce vedem ne menţine în stare de atenţie, dar la acest moment nu suntem îngrijoraţi în mod deosebit"". Până acum, toate cele 20 de state din zona euro au făcut trecerea la moneda unică începând cu data de 1 ianuarie. "
742668,politica," Au prezentat scrisorile de acreditare doi ambasadori ai țărilor Uniunii Europene: Nikolaos Krikos, reprezentantul diplomatic al Republicii Elene și Aune Kotli, reprezentantul diplomatic al Republicii Estonia. În cadrul ceremoniei oficiale, șefa statului a mulțumit statelor UE pentru susținerea Moldovei în parcursul european și, în special, a salutat decizia Greciei de a deschide la Chișinău, în viitorul apropiat, o ambasadă. Tot astăzi, scrisori de acreditare au prezentat Carlos Alejandro Poffo, ambasadorul Republicii Argentina, cu reședința la București și Vinta Some, ambasadorul Burkina Faso, cu reședința la Ankara. "
742644,politica," Opinia aparține sociologului, Doru Petruți și a fost expusă în cadrul unui interviu online, notează Noi.md  Potrivit lui, frica de a pierde puterea, a împins-o pe actuala Guvernare să închidă anumite surse mass-media, pentru că o altă agendă din păcate nu există. ”Simplu, pentru că nu ai altă agendă, fiindcă nu ai capacitățile necesare pentru a crea o agendă, iar acest șoc l-am văzut cum l-a preluat puterea unul după altul după 2010, oricît de pregătiți nu au fost și orice capacități umane și financiare nu ar fi avut, în momentul în care au ajuns la putere au avut acest șoc pentru că mecanismele care trebuie să le coordonezi sînt destul de complexe”, a mai spus sociologul.   "
742664,societate," Potrivit SHS, în legătură cu mărirea în continuare a deversării apei din Lacul de acumulare Dubăsari (r. Nistru) pîna la 1000 m3/s, în intervalul 18-25 aprilie va continua creșterea nivelului apei pe sectorul or. Dubăsari-s. Răscăieți cu 2.20-4.20 m, față de nivelul din 18 aprilie (ora 8:00). Izolat în locurile joase este posibilă ieşirea apei în luncă  Amintim că un ciclon atlantic a adus pe 17 aprilie precipitații pe aproape întreg teritoriul țării, care sau intensificat în partea de nord, iar temperaturile au scăzut simțitor. "
742646,societate," Statutul de producător eligibil mic a fost confirmat în baza a 50 de cereri, cu o capacitate totală de 20 MW, înregistrate conform principiului ,,primul venit-primul servit”. Cotele pentru producerea energiei solare au fost stabilite în conformitate cu Hotărîrea Guvernului cu privire la aprobarea limitelor de capacitate, a cotelor maxime și a categoriilor de capacitate în domeniul energiei electrice din surse regenerabile valabile pînă în 31 decembrie 2025. "
742630,politica," Dodon a venit cu un comentariu referitor la culoarea scurtelor a reprezentaților PAS. „Ceea ce ține de culoare, ei au schimbat culoarea nu de aceea că drapelul e UE, ei au început campania de informare despre integrarea europeană încă în luna martie, sfîrșit de februarie. Eu am fost prin raioane. Și stăteau corturile lor și oameni în scurte galbene. Știți ce facea populația? Înconjurau. Nu voiau să se apropie de galben în genere. De noțiunea de oameni buni, de PAS nu au ochis să-i vadă. Ei nu au ochi să-i vadă. Tehnologii lor sînt bravo, le pun un 10+ sau gîndit „hai să facem rebranding” și au făcut albastru. Și acum oameni se uită ca la ceva nou și se apropie de corturi să vadă cine sînt. Și cînd văd că sînt cei de la PAS, oameni se întorc. Oameni se sperie de culoarea galbenă.”, spune Igor Dodon.  Noi.md amintește că, intenția de a organiza referendumul concomitent cu alegerile prezidențiale a fost criticată dur în societate, unii juriști fiind de părerea că, asta poate duce la contopirea ilegală a două interese contradictorii: interesul general – la referendum; interesul de partid – la alegerile generale.  "
742645,sport," „Colegul nostru a demonstrat determinare și curaj, clasîndu-se pe locul trei în categoria de greutate 65 kg. Veniamin a reușit să se impună într-o competiție acerbă, demonstrînd abilități tehnice și fizice remarcabile. Locul său pe podium nu este doar o recompensă pentru munca asiduă, ci și o dovadă a angajamentului său față de sport și a dedicării sale pentru a atinge excelență în lupte libere. Felicitări, Borzin Veniamin, și noi succese în lumea sportului național”; anunță Poliția de Frontieră. "
742640,politica," ""În ceea ce privește anularea alegerilor, aici trebuie să remarcăm că oricare student la Drept știe că deciziile CC au valoare aplicativă pentru viitor, nu au aplicare pentru acțiunile care deja s-au consumat în trecut"", a spus Iurie Ciocan.  Ea face referire la decizia Curții Constituționale (CC), care a declarat anterior neconstituționale prevederile Codului Electoral, care le interzice membrilor partidelor scoase în afara legii, așa cum este și cazul partidului Șor, declarat neconstituțional în data de 19 iunie 2023, să candideze la alegeri. ""Aceste prevederi dau temă pentru acasă legiuitorilor pe viitor să nu aprobe prevederi legale, care ar aplica pedeapsa colectivă. În contextul anulării rezultatelor alegerilor precum că reprezentanții fostului partid Șor, Șansă, cum au mai fost ei, nu au putut participa la alegeri nu poate fi luat în considerare la modul serios"", a mai spus Iurie Ciocan. Potrivit acestuia, hotărîrile CC au aplicare pentru acțiunile viitoare, și nu pentru acțiunile care s-au consumat în trecut.  Îmi vine greu să spun ce anume i-a motivat pe juriștii sau personal pe doamna Tauber să facă aceste declarații, dar sigur că partidele politice în căutare de vizibilitate, în căutare de demonstrare a unor calități combative în raport cu alegătorii săi întreprind și acțini nu întotdeauna care au o logică a unui om obișnuit. Respectiv, cred că o fac de dragul să fie făcut, și nu mai mult"", a punctat Ciocan. Reprezentanta Serviciului de presă al CEC a comunicat pentru Noi.md că cererea Marinei Tauber a fost recepționată miercuri și că va fi examinată potrivit procedurii și termenului prevăzut de legislație, după care Comisia va anunța decizia.       "
742631,societate," După cum se menționează, la 17 aprilie curent s-a aflat despre profanarea monumentului comemorativ al soldaților sovietici căzuți pentru apărarea Patriei (Rîșcani), amenajat cu o zi mai devreme. Ambasada Rusiei la Chișinău a considerat acest act ilegal drept o încercare de a denigra istoria și de a devaloriza faptele eroice ale strămoșilor noștri-eliberatori.  Aceasta și-a exprimat recunoștința față de toți cetățenii interesați pentru înlăturarea promptă a consecințelor vandalismului și punerea în ordine a monumentului. "
742649,business,"Arena Chișinău reprezintă o platformă unică pentru evenimente sportive și culturale. Acesta este singurul complex din Moldova în care se pot desfășura competiții naționale și internaționale la înot, tenis, baschet, volei, triatlon și alte sporturi. Cooperarea strategică dintre Mastercard și Arena Chișinău va duce la introducerea tehnologiilor cashless și a altor inovații legate de tehnologiile de plată în cadrul complexului, la sprijinirea inițiativelor sportive și culturale, precum și la crearea unor oportunități speciale unice pentru toți oaspeții care aleg un stil de viață dinamic și activ. „Parteneriatul nostru cu Arena Chișinău reprezintă un pas important în sprijinirea dezvoltării sportului, vieții culturale și a inovației digitale în țară. Împreună, tindem să promovăm un stil de viață activ, să oferim sprijin considerabil persoanelor talentate și să dăruim experiențe de neuitat oamenilor din Moldova”, a declarat Irina Untila, Country Manager Mastercard Moldova. „Fiind principalul loc din țară pentru activități sportive și de divertisment, Arena Chișinău construiește planuri ambițioase pentru viitor. Suntem foarte încântați că Mastercard – o companie atât de importantă la nivel global – ne sprijină în procesul de dezvoltare”, menționează Sergiu Stanciu, director Arena Chișinău. Ca parte a strategiei sale ample de a implementa inovația digitală în țară, Mastercard lucrează alături de Arena Chișinău la crearea unei platforme digitale de vânzare a biletelor la evenimentele complexului. Platforma, care va fi lansată în curând, va simplifica semnificativ procesul de cumpărare a biletelor, oferind vizitatorilor posibilitatea de a efectua plăți online foarte rapid și comod. În plus, Mastercard a pregătit o serie de experiențe de neprețuit pentru oaspeții Arenei Chișinău, inclusiv masterclass-uri cu participarea sportivilor cu renume din țară. Scopul acestor evenimente este de a oferi participanților cunoștințe valoroase, de a-i inspira în progresul personal și de a sprijini tinerele talente sportive din țară. Deținătorii de carduri Mastercard vor primi oportunități exclusive, precum reduceri speciale la achiziționarea biletelor de pe noua platformă online și la achitarea activităților sportive de la Arena Chișinău. De exemplu, oaspeții vor putea profita de reduceri la piscină, la centrul fitness și la corturile de tenis, fiind încurajați să acorde mai multă atenție activității fizice și unui stil de viață sănătos. Pe lângă o mulțime de oferte unice, deținătorii de carduri Mastercard vor putea să beneficieze și de serviciul Fast Track al Mastercard, care va facilita accesul în complex în timpul evenimentelor. Arena Chișinău reprezintă un complex sportiv și de divertisment multifuncțional, conceput pentru a găzdui competiții de anvergură din diverse sporturi – baschet, volei, handbal, minifotbal, box etc. Pe teritoriul complexului se află centrul acvatic cu unicul bazin olimpic din Moldova. Arena Chișinău dispune de un centru de fitness, un club de tenis cu șapte corturi de joc și un cort pentru competiții, un amfiteatru cu capacitatea de 8.000 de spectatori și un food court. Totodată, aici se desfășoară evenimente culturale – concerte, conferințe și expoziții. Mai mult decât atât, Arena Chișinău găzduiește și birourile unor companii, inclusiv biroul Mastercard Moldova. "
742593,societate," Potrivit Direcției Generale Educație a municipiului Chișinău, anul școlar 2024-2025 va avea următoarea structură: -Semestrul I: 1 septembrie – 22 decembrie 2024 -Semestrul II: 9 ianuarie – 31 mai 2025  -Vacanța de toamnă: 28 octombrie – 3 noiembrie 2024; -Vacanța intersemestrială (de iarnă): 25 decembrie 2024 – 8 ianuarie 2025; -Vacanța de primăvară: 3 – 9 martie 2025; -Vacanța de Paști: 19 – 28 aprilie 2025. Tezele semestriale în învățămîntul liceal vor fi organizate pe parcursul anului de studii, după următorul program: -Sesiunea de iarnă, în perioada 9-20 decembrie 2024; -Sesiunea de vară, în perioada 12-23 mai 2025. Sesiunea de examene se va desfășura: La absolvirea învățămîntului primar, clasa a IV-a, în perioada 13-22 mai 2025; La absolvirea învățămîntului gimnazial, clasa a IX-a, în perioada 2-12 iunie 2025; La absolvirea învățămîntului liceal, clasa a XII-a, în perioada 3-20 iunie 2025. "
742616,societate," Acesta a vizitat sera unui tînăr care este specializat în cultivarea și vânzarea castraveților. Șeful Executivului a apreciat realizările tânărului antreprenor, accentuând că, prin tehnologii și inovație, pot fi construite afaceri de succes acasă, care să contribuie la dezvoltarea economică a țării noastre. „Sînteți un exemplu pentru cei care doresc să se implice în agricultură, prin investiții în produse proaspete și de calitate crescute cu grijă în satele noastre. Îi îndemn pe toți să susținem producătorii locali și să contribuim, astfel, la creșterea economică a țării”, a spus prim-ministrul Dorin Recean. De asemenea, premierul a vorbit despre programele guvernamentale, cu accent pe Programul guvernamental 373 - o inițiativă care răspunde concret necesităților oamenilor de afaceri. În context, antreprenorul a menționat că își dorește să extindă afacerea, să construiască mai multe sere tehnologizate pentru a-și mări capacitatea de producere. "
