id,category,text
742643,societate,"Spațiul Orange Kids vine în întâmpinarea nevoilor angajaților, fiind un loc sigur, prietenos și adaptat îngrijirii copiilor, în timp ce părinții lor participă la ședințe sau proiecte pentru care prezența fizică este preferabilă. În acest mod, angajații cu copii vor avea posibilitatea de a se concentra pe activitățile profesionale, având încrederea că cei mici sunt în siguranță și îngrijiți corespunzător.  La evenimentul de deschidere a spațiului, Olga SURUGIU, CEO Orange Moldova a spus: „Mă bucur că odată cu mutarea noastră în noul sediul Orange, putem susține și mai mult angajații și angajatele cu copii mici să lucreze de la oficiu atunci când au nevoie. De asemenea, sunt mândră că suntem prima companie din Moldova care a avut curajul să-și asume implementarea acestui proiect și sper să fim un exemplu de bune-practici și pentru alte afaceri locale.” Orange Kids include o zonă pentru activități și joacă, dar și pătucuri pentru odihnă. Spațiul va găzdui gratuit copii cu vârsta cuprinsă între 2 și 8 ani, care vor fi supravegheați de bone calificate. Proiectul pilot Orange Kids a fost realizat cu susținerea la toate etapele a Organizației Internaționale a Muncii, astfel încât să fie respectate întocmai cerințele Legii nr.367/2022 cu privire la serviciile alternative de îngrijire a copiilor, care permite angajatorilor să amenajeze astfel de spații pentru copiii angajaților.  Claire HARASTY, Directoare DWT/CO-Budapesta, Organizația Internațională a Muncii a punctat: „În Moldova, numai 15% dintre copiii de până la 3 ani merg la grădiniță sau creșă, iar peste 50% dintre femeile cu vârsta de muncă, deși sunt foarte calificate, renunță la carieră, pentru că nu au o soluție pentru îngrijirea copiilor. Datorită Orange, circa 600 de copii ai angajaților se vor bucura de un spațiu creat special pentru ei, iar părinții acestora vor putea îmbina cu succes creșterea copiilor cu creșterea carierei”. Invitat la evenimentul de lansare a spațiului Orange Kids, Alexei BUZU, Ministrul Muncii și Protecției Sociale, a menționat: „Mereu am avut acest vis să ajutăm părinții din Republica Moldova să combine viața profesională cu cea de familie. Pentru că au lipsit investițiile în acest domeniu, noi avem în prezent peste 150 de mii de femei în afara muncii și cred că asemenea inițiative vor fi exemple și pentru alte companii”.  Iar Ministrul Educației și Cercetării, Dan PERCIUN, a spus: „Orange a spart gheața și e bine să-i celebrăm pe cei care fac primul pas. Sperăm că vor fi un exemplu pentru multe alte companii din Moldova. Ambiția noastră este de a crește rata de participare a femeilor pe piața muncii, iar acesta e un bun început”. Katarina FRIED, Ambasadoarea Suediei în Republica Moldova, țară care susține acest program, a declarat: „Investițiile pe care le facem în educația timpurie sunt investiții într-un viitor mai bun. Sunt sigură că aceste inițiative vor fi utile tuturor, și mai ales mamelor, care vor putea să participe pe piața forței de muncă. Aceasta înseamnă nu doar contribuție la venitul familiei, ci și la egalitate de gen și la dezvoltarea țării. Ne bucură mult inițiativa Orange Moldova și considerăm că va fi apreciată mult de cei care muncesc aici și de copiii acestora”. Prezent la eveniment, Leonid CERESCU, Președinte al Confederației Naționale a Patronatului din Republica Moldova, unul dintre partenerii de implementare, a menționat: „Crearea acestui spațiu nu a fost un proces ușor. Mulți antreprenori au vrut să participe, dar au renunțat pe parcurs. Orange a fost printre puținii curajoși care au lansat această inițiativă”. Pe lângă beneficiile lunare în formă de suport financiar pentru angajații cu copii, zile suplimentare de concediu, asigurare medicală privată pentru membrii familiei, Orange Moldova oferă tuturor angajaților posibilitatea de a lucra de la distanță și de a urma un program de lucru flexibil, ceea ce le permite părinților să îmbine aspirațiile profesionale cu cele de familie. Gheorghe și Ana LUCHIAN, ambii angajați la Orange, susțin că acest spațiu le va permite să fie prezenți la birou, dar și aproape de fiica lor, în același timp. „Pentru fiica noastră Eva, acest proiect înseamnă un spațiu modern, adaptat necesităților și normelor de siguranță pentru copii. În plus, Orange Kids ne scutește de cheltuieli adiționale pentru bonă sau grădiniță privată, așa cum la cea de stat nu suntem acceptați la vârsta de 2 ani.” Pentru Cătălina BURCOVSCHI, angajată Orange, lansarea Orange Kids este, la fel, un ajutor important, „deoarece fiica noastră de 2 ani și 9 luni are nevoie de comunicare, iar acest proiect o va ajuta să construiască relații cu alți copii, să dezvolte abilități de comunicare și să se încadreze mai ușor la grădiniță. Un avantaj enorm este și faptul că voi putea lucra liniștită de la oficiu, dar aproape de ea, știind că se află în grija persoanelor responsabile.” Proiectul pilot Orange Kids a fost implementat de Orange Moldova, cu suportul Organizației Internaționale a Muncii (ILO) și Confederația Națională a Patronatului din Republica Moldova (CNPM), cu susținerea financiară a Suediei. Despre Orange Moldova: Orange Moldova este parte din Grupul Orange, unul dintre cei mai importanți operatori de telecomunicații din lume, cu peste 298 milioane de clienți în 26 de țări. Orange este cel mai mare operator din Moldova care oferă servicii voce și date mobile, Internet prin fibră și servicii TV, toate sub același brand. În prezent, peste 2,6 milioane de clienți sunt conectați la rețeaua și serviciile companiei, în care activează o echipă de peste 1450 de angajați. Orange Moldova deține cea mai performantă rețea 4G, dar și 2 premiere mondiale: HD Voice și HD Voice International. Serviciile sale pot fi accesate pe teritoriul întregii țări prin intermediul rețelei de peste 3600 puncte de vânzări. Recunoscut drept un lider în inovații, Orange deține unul dintre cele mai mari hub-uri IT din țară – Orange Systems, care este al doilea angajator pe piața de tehnologii informaționale din Moldova. În mai 2023, compania a inaugurat Orange Digital Center, un hub de învățare pe parcursul vieții, unde fiecare poate dobândi competențele digitale și antreprenoriale necesare unui viitor tehnologizat. Mai multe detalii despre produsele și serviciile companiei sunt disponibile pe www.orange.md "
742629,societate," Consiliile electorale de circumscripție au la dispoziție 7 zile pentru examinarea dosarelor și pentru a înregistra sau a refuza înregistrarea în cursa electorală, notează Noi.md.  Amintim că pe 19 mai 2024 vor avea loc alegeri locale noi pentru o nouă componență a consiliilor locale în localitățile Cairaclia și Salcia, raionul Taraclia, Chioselia Rusă și Cotovscoe din UTA Găgăuzia, dar și pentru alegerea primarului în comuna Tîrnova, raionul Dondușeni, orașul Bucovăț, raionul Strășeni, satul Sagaidac, raionul Cimișlia și comuna Hănăsenii Noi, raionul Leova De asemenea, în aceeași zi, vor avea loc alegeri parțiale pentru funcția de primar în localitățile Chioselia Rusă și Cotovscoe din UTA Găgăuzia, precum și alegeri parțiale pentru o nouă componență a consiliului local al comunei Cealîc, raionul Taraclia.  "
742637,politica," Despre acest lucru a anunțat liderul organizației politice, Renato Usatîi. Potrivit lui, este clar pentru toată lumea, inclusiv juriști și experți în drept electoral, că decizia este ilegală și neîntemeiată și partidul va insista pe cale legală să li se facă dreptate lor și tuturor celor 70% din cetățenii țării care cer alegeri parlamentare anticipate. La 28 februarie, liderul Partidului Nostru, Renato Usatîi, a propus organizarea unui referendum la vară pentru a afla dacă cetățenii moldoveni susțin ideea organizării alegerilor parlamentare anticipate.  CEC și-a motivat decizia prin faptul că astfel de astfel de alegeri parlamentare anticipate survin numai ca rezultat al dizolvării parlamentului care se efectuează de către președintele țării. Și că „demiterea persoanelor, atribuită în sfera de competență a președintelui, nu poate fi subiect al problemei supuse unui referendum republican. "
742599,societate," Suspectul a pătruns în șapte case din or. Codru, mun. Chișinău. „Bărbatul pătrundea în locuințe după ce se asigura că proprietarii lipsesc de acasă, apoi prin forțarea geamurilor din termopan, intra și sustrăgea bani. Prejudiciul total cauzat părților vătămate constituie 120 000 de lei. În cadrul acțiunilor procesual penale acesta și-a recunoscut vina.Bărbatul nu este la prima abatere de la lege, anterior fiind judecat pentru infracțiuni analogice”, spune Poliția. Bărbatul a fost plasat în arest pentru 30 de zile, iar conform legislației în vigoare el riscă închisoare de pînă la 4 ani. "
742592,capitala," Declarația a fost făcută de expertul în domeniul patrimonial și fostul director Agenţiei de Inspectare şi Restaurare a Monumentelor, Ion Ștefăniță, pentru redacția Noi.md Potrivit lui, de mai mulți ani, autoritățile nu întreprind nimic pentru a reconstitui părțile lipsă ale gardului, mai mult decît atît pe an ce trece gardul se distruge tot mai tare.  ”Gardul care este o adevărată comoară arhitecturală a orașului, a fost proiectat de A. Bernardazzi în 1860. Încă în 2019 am atras atenția asupra porțiunilor problemă din gardul dat care ar trebui să fie reconstituite. Potrivit Art. 35. – Finanţarea activităţii privind evidenţa, studierea, punerea în valoare, salvarea, protejarea, conservarea şi restaurarea monumentelor se asigură de la bugetul de stat prin Ministerul Culturii, de la bugetele locale, din contul plăţilor pentru arendă, inclusiv din chiria pentru terenul din zonele de protecţie ale monumentelor, din defalcările din beneficiul de pe turism, din venitul întreprinderilor, care stingheresc ocrotirea monumentelor, din beneficiul organelor asigurării de stat, în conformitate cu acordurile încheiate, din veniturile şi donaţiile organizaţiilor care, pe baza statutului lor, ocrotesc monumentele, din fondurile şi donaţiile unor persoane fizice şi juridice, precum şi din alte surse legale. Ministerul Culturii ar trebui să găsească resurse finaciare pentru reconstituirea acestui monument istoric al orașului”, a declarat Ion Ștefăniță. În 2019, expertul, pe cînd era director al Agenției de Inspectare și Restaurare a Monumentelor, a propus un proiect de renovare și restaurare a parcului ”Stefan cel Mare” din capitală, care includea și reconstituirea porțiunilor de gard problemă. Atunci, expertul spunea că prin acel proiect, tot ce se dorea era ca parcul să fie reparat, dar nu neaparat modernizat așa cum s-a interpretat greșit de societate. Din diferite motive, proiectul așa și nu a fost dus la sfîrșit. Potrivit lui Ion Ștefăniță, porțiunile problemă din gard trebuie să fie reconstituite din fontă, în baza proiectelor lui A. Bernardazzi, astfel păstrîndu-se linia arhitecturală a parcului.  De menționat că Gardul parcului familiar tuturor nu este atât de simplu: sunt zăbrele originale turnate după proiectul lui A. Bernardazzi în 1860, în Odesa. Gardul a fost constituit din 461 de elemente, a cântărit aproximativ 54 de tone şi a avut o lungime mai mult de o mie de metri. După uraganele din anii 1865 şi 1885, unele elemente au fost înlocuite, dar, în general, gardul s-a păstrat foarte bine. Iniţial s-a planificat de a înconjura parcul cu un perete solid de piatră, dar arhitectul genial a intervenit la timp. Redacția Noi.md a adresat o solicitare și către Ministerul Culturii, în care a întrebat dacă autoritățile au alocat un buget pentru reconstituirea porțiunilor problemă din gardul Parcului Ștefan cel Mare, însă la momentul publicării materialului nu am primit nici un comentariu. De notat că expertul în istoria orașului nostru, Cafegiuд, Alexandru Stucalov a comentat pentru Noi.md situația cu distrugerea parțială a gardului parcului Ștefan cel Mare din Chișinău. Stucalov a menționat că patrimoniul istoric al Chișinăului trebuie tratat cu dragoste, iar părțile lipsă din gard, care reprezintă o carte de vizită al Parcului Ștefan cel Mare din Chișinău, ar putea fi restabilite, dacă se dorește, prin instalarea unor porți noi sau a unor porțiuni de gard realizate în același stil, așa cum s-a procedat anterior, când a fost instalat monumentul lui Alexandru al II-lea, în 1886. "
742626,sport," Competiția s-a desfășurat în perioada 12-14 aprilie 2024, la Bratislava. Evenimentul a reunit aproximativ 600 de sportivi din 15 țări ale Europei.  -Locul I - Cozniuc Nicolai - proba individual masculin 9-11 ani; -Locul I - Cozniuc Nicolai, Stati Bogdana - pereche mixtă 9-11 ani; -Locul VII în finală - Morari Anastasia - categoria individual feminin Juniori 15-17 ani; Cei care îi antrenează pe sportivi sînt Valentina Mihai și Ludmila Mihai.  "
742594,societate," Datele au fost făcute publice de Ministerul Sănătății în contextul marcării Zilei mondiale a hemofiliei, notează Noi.md. Potrivit MS, evenimentul are scopul de a informa și sensibiliza opinia publică cu privire la această maladie și alte tulburări hemoragice ereditare. În țara noastră tratamentul pentru hemofilie se oferă gratuit, fiind achiziționat din sursele centralizate programate de către Ministerul Sănătății. Astfel, în anul 2024, au fost alocate 23,2 milioane de lei pentru procurarea factorilor de coagulare. Totodată, în martie curent, a fost aprobat Programul național privind bolile rare pentru anii 2024-2028, în vederea asigurării accesului echitabil la diagnostic precoce, tratament și servicii de reabilitare pentru persoanele cu boli rare. Realizarea programului va extinde cu 25% acoperirea tratamentului medicamentos specific și a serviciilor de reabilitare pentru mai multe boli rare, inclusiv hemofilia, comparativ cu anul 2023. În Republica Moldova, copiilor cu hemofilie le este oferită asistență medicală în cadrul secției Hematologie a Institutului Mamei și Copilului, iar adulților – în Departamentul Hematologie al Institutului Oncologic. "
742590,in-lume," Despre aceste planuri a anunțat coordonatorul protestelor și poliția. La ieșirea din Polonia va fi permisă trecerea acîte un camion pe oră, în timp ce trecerea vehiculelor de pasageri și autoturismelor nu va fi îngrădită. Coorganizatorul protestelor, Romand Kondruw, a declarat că fermierii ""încă așteaptă negocieri cu guvernul"" și că acordurile încheiate la Jasenka nu sunt implementate corespunzător, transmite Noi.md cu referire la eurointegration. În același timp, blocajele continuă și în apropierea punctelor de control Dorohusk-Yahodyn și Hrebenne-Rava-Ruska. "
742620,politica," În cadrul emisiunii „Moldova Live” de la Exclusiv TV, Igor Dodon a îndemnat populația să boicoteze plebiscitul, sugerînd ca alegătorii să nu participe sau, dacă aleg să voteze, să se exprime împotriva propunerii.  Mai mult, liderul PSRM spune că există reticență și din partea Uniunii Europene privind această inițiativă. „Bruxelles-ul e împotriva acestui referendum și i-a spus (Maiei Sandu – n.n.) că nu trebuie făcut. Asta-i ambiția personală a Maiei Sandu, cu orice preț, să meargă înainte. Există partide proeuropene, care sînt împotriva acestui referendum, care au aceleași argumente ca și noi. Noi nu sîntem împotriva negocierilor cu UE, haideți să negociem, dar nu puneți carul înaintea boilor”, a adăugat președintele PSRM.  Noi.md amintește că, intenția de a organiza referendumul concomitent cu alegerile prezidențiale a fost criticată dur în societate, unii juriști fiind de părerea că, asta poate duce la contopirea ilegală a două interese contradictorii: interesul general – la referendum; interesul de partid – la alegerile generale. "
742617,economie," Astfel, prețul maxim al benzinei A-95 va constitui 26,35 lei/litru (+62 bani), iar al motorinei fără denumire comercială – 22,15 lei/litru (-9 bani), transmite Noi.md.  Prețurile altor tipuri de produse petroliere vor fi stabilite de fiecare benzinărie individual. Benzinăriile au dreptul să comercializeze cu amănuntul alte tipuri de produse petroliere principale, cu excepția celor pentru care ANRE stabilește prețuri maxime, numai cu condiția ca la aceeași stație de alimentare să fie vîndute și produse petroliere principale de tip standard. "
742583,in-lume," Șefa Comisiei Europene, Ursula von der Leyen, admite că aceste practici încalcă regulile UE privind piața unică. Procesul, denumit o procedură de încălcare a dreptului comunitar, ar urma să fie inițiat în următoarele zile.  Taxa suplimentară a crescut semnificativ de la introducerea sa în octombrie 2022, generînd preocupări din partea unor guverne UE care consideră că încalcă regulile pieței unice. Ministerul Economiei și al Climei din Germania a susținut că taxa este nediscriminatorie și că alte țări UE au beneficiat de umplerea rapidă a depozitelor germane de gaze, contribuind astfel la securitatea energetică europeană și la stabilizarea prețurilor.  "
742578,societate," Pasagerul se îndrepta spre România în dupa amiaza zilei de ieri, 17 aprilie, în punctul de trecere a frontierei Costești s-a prezentat un moldovean pentru formalitățile de ieșire din țară, notează Noi.md. Acționînd în baza analizei de risc, prin efectuarea unui control adițional, polițiștii de frontieră au descoperit asupra persoanei un permis de conducere care ar fi emis de autoritățile din Ucraina . Din primele cercetări a fost stabilit că permisul conține semne vădite de falsificare. Moldoveanul, originar din r. Ştefan-Vodă, a recunoscut că şi-a perfectat permisul în Polonia, contra sumei de 600 EUR. În continuare cercetările pe caz sînt efectuate în vederea elucidării circumstanțelor și atragerii la răspundere pentru uz de acte oficiale false. "
742603,politica," O astfel de opinie a exprimat Alexandru Berlinschi, care a demisionat din funcția de secretar al Comisiei Electorale Centrale din Republica Moldova. El a amintit experiența celor două referendumuri - constituțional și consultativ - organizate la 5 septembrie 2010 și 24 februarie 2019. Primul plebiscit, care ar fi schimbat constituția pentru a permite alegerea președintelui de către popor, a eșuat din cauza unui partid de opoziție care avea patruzeci de deputați, căruia i s-a opus o coaliție de patru partide din Alianța pentru Integrare Europeană, aflată la putere la acea vreme. Referendumul a eșuat din cauza prezenței scăzute la vot, de 30,29%. Al doilea referendum privind reducerea numărului de deputați, deși a avut loc în aceeași zi cu alegerile parlamentare, a înregistrat o prezență la vot de 39,72%, deși aproape jumătate dintre alegători au luat buletinele de vot pentru alegerea deputaților. În ciuda prezenței ridicate la alegerile parlamentare, plebiscitul a fost aproape de eșec chiar și în absența unei campanii de boicotare.  Conform proiectului, referendumul privind aderarea Republicii Moldova la Uniunea Europeană ar trebui să aibă loc la 20 octombrie. Întrebarea propusă pentru referendum va fi: ""Sînteți pentru aderarea Republicii Moldova la Uniunea Europeană?"".  Intenția de a organiza referendumul în același timp cu alegerile prezidențiale a fost aspru criticată în societate, unii experți în drept considerînd că aceasta ar putea duce la o unirea ilegală a două interese contradictorii: interesul general – în cadrul referendumului; interesul de partid – în cadrul alegerilor generale. "
742574,societate," Totodată, vor fi reconstruite cămine studențești și aziluri de bătrîni pentru alți 1460 de beneficiari. Guvernul a aprobat, în acest sens, ratificarea Acordului-cadru de împrumut și a Acordului de grant pentru proiectul „Locuințe publice III”. Proiectul va contribui la creșterea capacității fondului public de locuințe, destinate persoanelor social-vulnerabile care nu dispun de condiții satisfăcătoare de trai, precum și pentru angajații din sectorul public care prestează servicii sociale și administrative. De asemenea, urmează a fi modernizate spațiile de cazare ale instituțiilor de învățămînt și vor fi la reabilitate sau extinse spațiile de cazare ale instituțiilor de plasament pentru persoanele vîrstnice. Astfel, pentru implementarea Proiectului „Locuințe Publice III”, CEB va acorda un împrumut de 20 de milioane de euro. Totodată, un grant în valoare de un milion de euro va fi oferit din Fondul de Investiții Verzi și Sociale pentru implementarea măsurilor de eficiență energetică, contribuția financiară urmînd să fie suplimentată cu încă un grant de 6 milioane de euro din fondul E5P. Contribuția financiară a Republicii Moldova va constitui 1,1 milioane de euro.  "
742568,societate," Natalia Șveț, una din cele mai populare antrenoare de fitness s-a oferit să instruiască, gratis, timp de 6 săptămîni, doamnele aflate în detenție. În scop de solidaritate, dar și de promovare a unui mod sănătos de viață după gratii, la prima ședință de sport, alături de femeile din detenție s-au antrenat și doamnele din cadrul Administrației Naționale a Penitenciarelor, în frunte cu directoarea adjunctă Liuba Jignea-Suveica. Pe lîngă antrenamentele performante, trainer-ul Natalia Șveț, a venit cu un șir de recomandări în fața celor prezenți ce ține de o poziționare corectă, respirație corespunzătoare, stare de sănătate pozitivă și altele. Totodată, antrenoarea a dat promisiuni că timp de 6 săptămîni va depune toată străduința ca să transmită femeilor din detenție o parte din dragostea sa față de sport, dar și experiența acumulată, astfel încît, pe viitor, aceste antrenamente să aibă continuitate în cadrul penitenciarului. „Rănile cîștigătorilor se vindecă mai repede, este un fenomen stabilit științific. La fel ca și faptul că frica și stresul slăbesc imunitatea. Trăim un stres continuu și acest lucru este cu certitudine dăunător pentru sănătate. A venit timpul să schimbăm lucrurile!„ a menționat înainte de a purcede la „treabă„ Natalia. Administrația Națională a Penitenciarelor aduce sincere mulțumiri antrenoarei Natalia Șveț pentru efortul și contribuția sa la reintegrarea persoanelor din detenție.  "
742587,in-lume," Anunțul a fost făcut de preşedintele Consiliului European, Charles Michel. Decizia a venit ca urmare a atacului asupra Israelului declanșat săptămîna trecută.  Amintim că săptămîna trecută, în noaptea de sîmbătă spre duminică, Iranul a lansat un atac în valuri de drone, rachete de croazieră și rachete balistice către teritoriul israelian. Atacul a fost considerat un răspuns la o lovitură din 1 aprilie asupra consultatului ambasadei din Iran, aflată în Damasc.  "
742561,societate," În cadrul ședinței au fost discutate aspecte practice privind schimbul de date referitor la Rapoartele de expertiză eliberate de către Camera de Comerț și Industrie. Astfel, instituțiile au fost deschise în vederea acordării suportului necesar întru digitalizarea acestui proces, care de altfel va aduce atît beneficii mediului de afaceri cît și autorității vamale. Totodată, întrevederea a constituit o oportunitate de a face un schimb de opinii cu privire la interacțiunea celor două autorități cu reprezentanții mediului de afaceri de pe ambele maluri ale Nistrului, prin prisma acordării suportului instituțional în vederea aplicării conforme a cadrului normativ și a impulsionării relațiilor comerciale.  Serviciul Vamal și Camera de Comerț și Industria au convenit asupra intensificării conlucrării interinstituționale, în baza punctelor de tangență stabilite ca fiind prioritare, conform domeniilor de competență. "
742557,economie," În cadrul ședinței, secretarul de stat Vasile Șarban a subliniat că ministerul în calitate de autoritate competentă în domeniu susține activitatea organismelor de inspecție și certificare naționale și va oferi tot suportul necesar, însă acestea trebuie să se asigure că respectă termenii legali pentru menținerea acreditării și autorizării necesare pentru activitatea în domeniul producției ecologice, precum și să își asume responsabilitatea față de operatorii ecologici cu care au încheiat contracte de prestare a serviciilor de inspecție și certificare.  "
